{
  "jsonrpc": "2.0",
  "id": 1,
  "method": "initialize",
  "params": {
    "protocolVersion": "2024-11-05",
    "capabilities": {
      "experimental": {
        "customFeature": true
      },
      "roots": {
        "listChanged": true
      },
      "sampling": {
        "enabled": true,
        "rate": 0.1
      }
    },
    "clientInfo": {
      "name": "test-client",
      "version": "1.0.0"
    }
  }
} 